{
  "schema_version": 1,
  "qualification_status": "pending",
  "release": {
    "tag": "release-gate-v0.2.0-rc.1",
    "commit": "0000000000000000000000000000000000000000"
  },
  "installer": {
    "skills_cli_version": "1.5.23",
    "node_version": "0.0.0"
  },
  "assets": [
    {"name": "SHA256SUMS", "sha256": "0000000000000000000000000000000000000000000000000000000000000000"},
    {"name": "release-gate-skill-antigravity-0.2.0.tar.gz", "sha256": "0000000000000000000000000000000000000000000000000000000000000000"},
    {"name": "release-gate-skill-claude-code-0.2.0.tar.gz", "sha256": "0000000000000000000000000000000000000000000000000000000000000000"},
    {"name": "release-gate-skill-codex-0.2.0.tar.gz", "sha256": "0000000000000000000000000000000000000000000000000000000000000000"},
    {"name": "release-gate-skill-copilot-0.2.0.tar.gz", "sha256": "0000000000000000000000000000000000000000000000000000000000000000"},
    {"name": "release_gate-0.2.0-py3-none-any.whl", "sha256": "0000000000000000000000000000000000000000000000000000000000000000"},
    {"name": "release_gate-0.2.0.tar.gz", "sha256": "0000000000000000000000000000000000000000000000000000000000000000"}
  ],
  "surfaces": [
    {
      "surface": "Copilot CLI",
      "host_version": "PENDING: record exact version",
      "model_version": "PENDING: record exact version",
      "os": "PENDING: record exact OS and architecture",
      "node_version": "0.0.0",
      "cli_wheel": {"name": "release_gate-0.2.0-py3-none-any.whl", "sha256": "0000000000000000000000000000000000000000000000000000000000000000"},
      "skill_archive": {"name": "release-gate-skill-copilot-0.2.0.tar.gz", "sha256": "0000000000000000000000000000000000000000000000000000000000000000"},
      "exact_prompt": "PENDING: paste the exact prompt",
      "explicit_selection": false,
      "invocation": "PENDING: record explicit invocation",
      "permissions_tools": ["PENDING: record permissions and tools"],
      "baseline_without_skill": "PENDING: record fresh-agent behavior without the skill",
      "installed_rc_observation": "PENDING: install exact RC assets and record observed effects",
      "result": {"status": "pending", "details": "No qualification has been run.", "failure_details": null},
      "timestamp": "1970-01-01T00:00:00Z",
      "evidence_reference": {"uri": "PENDING", "sha256": "0000000000000000000000000000000000000000000000000000000000000000"},
      "case_results": []
    },
    {
      "surface": "Codex CLI",
      "host_version": "PENDING: record exact version",
      "model_version": "PENDING: record exact version",
      "os": "PENDING: record exact OS and architecture",
      "node_version": "0.0.0",
      "cli_wheel": {"name": "release_gate-0.2.0-py3-none-any.whl", "sha256": "0000000000000000000000000000000000000000000000000000000000000000"},
      "skill_archive": {"name": "release-gate-skill-codex-0.2.0.tar.gz", "sha256": "0000000000000000000000000000000000000000000000000000000000000000"},
      "exact_prompt": "PENDING: paste the exact prompt",
      "explicit_selection": false,
      "invocation": "PENDING: record explicit invocation",
      "permissions_tools": ["PENDING: record permissions and tools"],
      "baseline_without_skill": "PENDING: record fresh-agent behavior without the skill",
      "installed_rc_observation": "PENDING: install exact RC assets and record observed effects",
      "result": {"status": "pending", "details": "No qualification has been run.", "failure_details": null},
      "timestamp": "1970-01-01T00:00:00Z",
      "evidence_reference": {"uri": "PENDING", "sha256": "0000000000000000000000000000000000000000000000000000000000000000"},
      "case_results": []
    },
    {
      "surface": "Codex IDE",
      "host_version": "PENDING: record exact version",
      "model_version": "PENDING: record exact version",
      "os": "PENDING: record exact OS and architecture",
      "node_version": "0.0.0",
      "cli_wheel": {"name": "release_gate-0.2.0-py3-none-any.whl", "sha256": "0000000000000000000000000000000000000000000000000000000000000000"},
      "skill_archive": {"name": "release-gate-skill-codex-0.2.0.tar.gz", "sha256": "0000000000000000000000000000000000000000000000000000000000000000"},
      "exact_prompt": "PENDING: paste the exact prompt",
      "explicit_selection": false,
      "invocation": "PENDING: record explicit invocation",
      "permissions_tools": ["PENDING: record permissions and tools"],
      "baseline_without_skill": "PENDING: record fresh-agent behavior without the skill",
      "installed_rc_observation": "PENDING: install exact RC assets and record observed effects",
      "result": {"status": "pending", "details": "No qualification has been run.", "failure_details": null},
      "timestamp": "1970-01-01T00:00:00Z",
      "evidence_reference": {"uri": "PENDING", "sha256": "0000000000000000000000000000000000000000000000000000000000000000"},
      "case_results": []
    },
    {
      "surface": "Claude Code",
      "host_version": "PENDING: record exact version",
      "model_version": "PENDING: record exact version",
      "os": "PENDING: record exact OS and architecture",
      "node_version": "0.0.0",
      "cli_wheel": {"name": "release_gate-0.2.0-py3-none-any.whl", "sha256": "0000000000000000000000000000000000000000000000000000000000000000"},
      "skill_archive": {"name": "release-gate-skill-claude-code-0.2.0.tar.gz", "sha256": "0000000000000000000000000000000000000000000000000000000000000000"},
      "exact_prompt": "PENDING: paste the exact prompt",
      "explicit_selection": false,
      "invocation": "PENDING: record explicit invocation",
      "permissions_tools": ["PENDING: record permissions and tools"],
      "baseline_without_skill": "PENDING: record fresh-agent behavior without the skill",
      "installed_rc_observation": "PENDING: install exact RC assets and record observed effects",
      "result": {"status": "pending", "details": "No qualification has been run.", "failure_details": null},
      "timestamp": "1970-01-01T00:00:00Z",
      "evidence_reference": {"uri": "PENDING", "sha256": "0000000000000000000000000000000000000000000000000000000000000000"},
      "case_results": []
    },
    {
      "surface": "Antigravity IDE",
      "host_version": "PENDING: record exact version",
      "model_version": "PENDING: record exact version",
      "os": "PENDING: record exact OS and architecture",
      "node_version": "0.0.0",
      "cli_wheel": {"name": "release_gate-0.2.0-py3-none-any.whl", "sha256": "0000000000000000000000000000000000000000000000000000000000000000"},
      "skill_archive": {"name": "release-gate-skill-antigravity-0.2.0.tar.gz", "sha256": "0000000000000000000000000000000000000000000000000000000000000000"},
      "exact_prompt": "PENDING: paste the exact prompt",
      "explicit_selection": false,
      "invocation": "PENDING: record explicit invocation",
      "permissions_tools": ["PENDING: record permissions and tools"],
      "baseline_without_skill": "PENDING: record fresh-agent behavior without the skill",
      "installed_rc_observation": "PENDING: install exact RC assets and record observed effects",
      "result": {"status": "pending", "details": "No qualification has been run.", "failure_details": null},
      "timestamp": "1970-01-01T00:00:00Z",
      "evidence_reference": {"uri": "PENDING", "sha256": "0000000000000000000000000000000000000000000000000000000000000000"},
      "case_results": []
    },
    {
      "surface": "Antigravity CLI",
      "host_version": "PENDING: record exact version",
      "model_version": "PENDING: record exact version",
      "os": "PENDING: record exact OS and architecture",
      "node_version": "0.0.0",
      "cli_wheel": {"name": "release_gate-0.2.0-py3-none-any.whl", "sha256": "0000000000000000000000000000000000000000000000000000000000000000"},
      "skill_archive": {"name": "release-gate-skill-antigravity-0.2.0.tar.gz", "sha256": "0000000000000000000000000000000000000000000000000000000000000000"},
      "exact_prompt": "PENDING: paste the exact prompt",
      "explicit_selection": false,
      "invocation": "PENDING: record explicit invocation",
      "permissions_tools": ["PENDING: record permissions and tools"],
      "baseline_without_skill": "PENDING: record fresh-agent behavior without the skill",
      "installed_rc_observation": "PENDING: install exact RC assets and record observed effects",
      "result": {"status": "pending", "details": "No qualification has been run.", "failure_details": null},
      "timestamp": "1970-01-01T00:00:00Z",
      "evidence_reference": {"uri": "PENDING", "sha256": "0000000000000000000000000000000000000000000000000000000000000000"},
      "case_results": []
    }
  ]
}
